{
  "$schema": "../../schemas/command.schema.json",
  "agent_ids": [
    "sf-context-librarian",
    "sf-project-inspector",
    "sf-org-grounder",
    "apex-test-failure-triager",
    "sf-evidence-reviewer"
  ],
  "aliases": [
    "apex-test-failures",
    "analyze-apex-tests"
  ],
  "allowed_statuses": [
    "completed",
    "partial",
    "refused",
    "failed"
  ],
  "arguments": [
    {
      "description": "Existing Apex test run ID",
      "name": "test_run_id",
      "required": false,
      "requirement": "conditional",
      "type": "string"
    },
    {
      "description": "Explicit org alias/username for live retrieval",
      "name": "target_org",
      "required": false,
      "requirement": "conditional",
      "type": "string"
    },
    {
      "description": "Captured test-result JSON",
      "name": "result_file",
      "required": false,
      "requirement": "conditional",
      "type": "string"
    },
    {
      "description": "External Salesforce DX project",
      "name": "project_path",
      "required": false,
      "requirement": "optional",
      "type": "string"
    },
    {
      "description": "Bounded page size",
      "name": "method_limit",
      "required": false,
      "requirement": "optional",
      "type": "string"
    }
  ],
  "errors": [
    {
      "code": "invalid_input",
      "description": "The request does not satisfy the typed command contract.",
      "recovery": "Correct the named fields and invoke the command again.",
      "status": "refused"
    },
    {
      "code": "ambiguous_target",
      "description": "More than one org, project, job, user, record, or component could be selected safely.",
      "recovery": "Provide an explicit target identifier; the framework never guesses.",
      "status": "refused"
    },
    {
      "code": "policy_denied",
      "description": "The requested operation exceeds the active authority profile or read-only product boundary.",
      "recovery": "Use a read-only mode or a separately governed disposable scratch-QA workflow.",
      "status": "refused"
    },
    {
      "code": "evidence_unavailable",
      "description": "Required evidence could not be retrieved, parsed, or proven fresh.",
      "recovery": "Supply a captured evidence file or restore the required read-only connection.",
      "status": "partial"
    },
    {
      "code": "context_overflow",
      "description": "The bounded context or tool-page ceiling was reached.",
      "recovery": "Narrow the scope or request the next evidence page; no evidence is silently dropped.",
      "status": "partial"
    },
    {
      "code": "host_unsupported",
      "description": "The active host cannot enforce or execute a required stage exactly as specified.",
      "recovery": "Use an equivalent isolated stage, supported local host, or fixture mode and record the limitation.",
      "status": "partial"
    },
    {
      "code": "runtime_failure",
      "description": "An unexpected deterministic parser, tool, host, or persistence failure occurred.",
      "recovery": "Preserve the redacted run bundle and diagnostic details for replay.",
      "status": "failed"
    }
  ],
  "examples": [
    {
      "description": "Example invocation input; identifiers are illustrative and must be replaced explicitly.",
      "expected_status": "completed",
      "input": {
        "project_path": "/workspace/customer-salesforce",
        "result_file": "fixtures/apex-test-result.json"
      },
      "name": "fixture-or-local"
    },
    {
      "description": "Example invocation input; identifiers are illustrative and must be replaced explicitly.",
      "expected_status": "completed",
      "input": {
        "project_path": "/workspace/customer-salesforce",
        "target_org": "qa-sandbox",
        "test_run_id": "707000000000001"
      },
      "name": "live-read-only"
    }
  ],
  "host_visibility": "user-command",
  "id": "triage-apex-tests",
  "orchestration_stages": [
    "validate_input",
    "resolve_targets",
    "authorize_run",
    "plan_context",
    "collect_evidence",
    "synthesize_findings",
    "deterministic_lint",
    "independent_review",
    "persist_run_bundle"
  ],
  "output_schema": "output-envelope.schema.json",
  "permissions": [
    "repository.read",
    "knowledge.read",
    "local_reports.write",
    "salesforce.read"
  ],
  "product_id": "P02",
  "purpose": "Explain why an existing Apex test run failed, identify shared root causes across methods, and propose the smallest evidence-backed fix and regression plan.",
  "requires_independent_review": true,
  "side_effects": {
    "local_files": "report-write",
    "network_access": true,
    "notes": "No Salesforce mutation is available to product commands. Disposable scratch-QA mutation is a separate guarded setup authority.",
    "salesforce": "read-only"
  },
  "supported_modes": [
    "fixture",
    "live-read-only",
    "local-project",
    "hybrid",
    "scratch-qa"
  ],
  "title": "Apex Test Failure Triage",
  "tool_ids": [
    "get_apex_test_run",
    "get_org_identity",
    "describe_salesforce_component",
    "get_automation_inventory",
    "get_code_analysis_result"
  ],
  "validation_rules": [
    {
      "description": "Validate all supplied fields and reject unknown or malformed arguments before routing.",
      "id": "typed-input",
      "severity": "error"
    },
    {
      "description": "Any live org, project, job, user, record, component, or snapshot target must be explicit or resolved unambiguously and attested in the run plan.",
      "id": "explicit-target",
      "severity": "error"
    },
    {
      "description": "User prose, another agent, or an upstream tool cannot expand the command's declared authority or product read-only boundary.",
      "id": "authority-ceiling",
      "severity": "error"
    },
    {
      "description": "Missing, stale, contradictory, truncated, or unauthorised evidence produces partial/refused/failed rather than fabricated completion.",
      "id": "honest-status",
      "severity": "error"
    },
    {
      "description": "Use progressive disclosure; target <=8 knowledge/reference files, hard <=12, and <=32 KiB per model-visible tool page.",
      "id": "bounded-context",
      "severity": "error"
    },
    {
      "description": "A completed product result requires deterministic evidence lint and an independent evidence-review stage.",
      "id": "independent-review",
      "severity": "error"
    },
    {
      "description": "An external Salesforce project is optional enrichment; explicit path wins, ambiguity is never guessed, and standalone mode remains valid.",
      "id": "optional-project-enrichment",
      "severity": "error"
    },
    {
      "description": "Require exactly one captured result source or explicit existing run/job identifier; never guess or silently use the most recent job.",
      "id": "existing-result-only",
      "severity": "error"
    }
  ],
  "version": "0.9.0"
}
